{
  "manifestVersion": "1.0.0",
  "generatedAt": null,
  "contextAnalysisPacks": [
    {
      "id": "context-qwen3-0.6b",
      "type": "context-analysis",
      "language": "multilingual",
      "displayName": "Stream Pulse Low System Context Analyzer",
      "mode": "low-system",
      "status": "planned",
      "version": null,
      "runtime": null,
      "format": null,
      "sourceModel": null,
      "sourceRevision": null,
      "sourceUrl": null,
      "licenseId": null,
      "licenseFile": null,
      "attributionFile": null,
      "redistributable": null,
      "commercialUseAllowed": null,
      "modificationAllowed": null,
      "fileName": null,
      "downloadUrl": null,
      "backupLocations": [],
      "sizeBytes": null,
      "sha256": null,
      "minimumRamMb": null,
      "recommendedRamMb": null,
      "minimumCpuThreads": null,
      "gpuOptional": null,
      "contextWindow": null,
      "supportedTasks": [
        "contextual_chat_analysis",
        "mood_analysis",
        "conflict_estimation",
        "sarcasm_estimation",
        "complaint_estimation",
        "question_intensity_estimation",
        "spam_intensity_estimation",
        "alert_recommendation"
      ],
      "description": "Planned Qwen3-0.6B context analyzer for low-system mode. It will analyze a short recent-message window with a selected language profile and return strict JSON.",
      "evaluationStatus": "not_started",
      "evaluationNotes": null,
      "optional": false
    },
    {
      "id": "context-qwen3-1.7b",
      "type": "context-analysis",
      "language": "multilingual",
      "displayName": "Stream Pulse High Accuracy Context Analyzer",
      "mode": "high-accuracy",
      "status": "planned",
      "version": null,
      "runtime": null,
      "format": null,
      "sourceModel": null,
      "sourceRevision": null,
      "sourceUrl": null,
      "licenseId": null,
      "licenseFile": null,
      "attributionFile": null,
      "redistributable": null,
      "commercialUseAllowed": null,
      "modificationAllowed": null,
      "fileName": null,
      "downloadUrl": null,
      "backupLocations": [],
      "sizeBytes": null,
      "sha256": null,
      "minimumRamMb": null,
      "recommendedRamMb": null,
      "minimumCpuThreads": null,
      "gpuOptional": null,
      "contextWindow": null,
      "supportedTasks": [
        "contextual_chat_analysis",
        "mood_analysis",
        "conflict_estimation",
        "sarcasm_estimation",
        "complaint_estimation",
        "question_intensity_estimation",
        "spam_intensity_estimation",
        "alert_recommendation"
      ],
      "description": "Planned Qwen3-1.7B context analyzer for high-accuracy mode. It will analyze a short recent-message window with a selected language profile and return strict JSON.",
      "evaluationStatus": "not_started",
      "evaluationNotes": null,
      "optional": false
    }
  ],
  "languagePromptPacks": [
    {
      "id": "prompt-en-US",
      "type": "language-prompt",
      "language": "en-US",
      "displayName": "Stream Pulse English Language Profile",
      "status": "planned",
      "version": null,
      "format": null,
      "fileName": null,
      "downloadUrl": null,
      "backupLocations": [],
      "sizeBytes": null,
      "sha256": null,
      "containsModelWeights": false,
      "profileContents": [
        "analysis_instructions",
        "twitch_terminology",
        "common_slang_examples",
        "sarcasm_examples",
        "playful_insult_examples",
        "technical_complaint_examples",
        "output_labels",
        "confidence_thresholds"
      ],
      "description": "Planned small text or JSON configuration package for English chat analysis.",
      "evaluationStatus": "not_started",
      "evaluationNotes": null,
      "optional": false
    },
    {
      "id": "prompt-es-ES",
      "type": "language-prompt",
      "language": "es-ES",
      "displayName": "Stream Pulse Spanish Language Profile",
      "status": "planned",
      "version": null,
      "format": null,
      "fileName": null,
      "downloadUrl": null,
      "backupLocations": [],
      "sizeBytes": null,
      "sha256": null,
      "containsModelWeights": false,
      "profileContents": [
        "analysis_instructions",
        "twitch_terminology",
        "common_slang_examples",
        "sarcasm_examples",
        "playful_insult_examples",
        "technical_complaint_examples",
        "output_labels",
        "confidence_thresholds"
      ],
      "description": "Planned small text or JSON configuration package for Spanish chat analysis.",
      "evaluationStatus": "not_started",
      "evaluationNotes": null,
      "optional": false
    },
    {
      "id": "prompt-pt-BR",
      "type": "language-prompt",
      "language": "pt-BR",
      "displayName": "Stream Pulse Brazilian Portuguese Language Profile",
      "status": "planned",
      "version": null,
      "format": null,
      "fileName": null,
      "downloadUrl": null,
      "backupLocations": [],
      "sizeBytes": null,
      "sha256": null,
      "containsModelWeights": false,
      "profileContents": [
        "analysis_instructions",
        "twitch_terminology",
        "common_slang_examples",
        "sarcasm_examples",
        "playful_insult_examples",
        "technical_complaint_examples",
        "output_labels",
        "confidence_thresholds"
      ],
      "description": "Planned small text or JSON configuration package for Brazilian Portuguese chat analysis.",
      "evaluationStatus": "not_started",
      "evaluationNotes": null,
      "optional": false
    },
    {
      "id": "prompt-ru-RU",
      "type": "language-prompt",
      "language": "ru-RU",
      "displayName": "Stream Pulse Russian Language Profile",
      "status": "planned",
      "version": null,
      "format": null,
      "fileName": null,
      "downloadUrl": null,
      "backupLocations": [],
      "sizeBytes": null,
      "sha256": null,
      "containsModelWeights": false,
      "profileContents": [
        "analysis_instructions",
        "twitch_terminology",
        "common_slang_examples",
        "sarcasm_examples",
        "playful_insult_examples",
        "technical_complaint_examples",
        "output_labels",
        "confidence_thresholds"
      ],
      "description": "Planned small text or JSON configuration package for Russian chat analysis.",
      "evaluationStatus": "not_started",
      "evaluationNotes": null,
      "optional": false
    },
    {
      "id": "prompt-de-DE",
      "type": "language-prompt",
      "language": "de-DE",
      "displayName": "Stream Pulse German Language Profile",
      "status": "planned",
      "version": null,
      "format": null,
      "fileName": null,
      "downloadUrl": null,
      "backupLocations": [],
      "sizeBytes": null,
      "sha256": null,
      "containsModelWeights": false,
      "profileContents": [
        "analysis_instructions",
        "twitch_terminology",
        "common_slang_examples",
        "sarcasm_examples",
        "playful_insult_examples",
        "technical_complaint_examples",
        "output_labels",
        "confidence_thresholds"
      ],
      "description": "Planned small text or JSON configuration package for German chat analysis.",
      "evaluationStatus": "not_started",
      "evaluationNotes": null,
      "optional": false
    },
    {
      "id": "prompt-fr-FR",
      "type": "language-prompt",
      "language": "fr-FR",
      "displayName": "Stream Pulse French Language Profile",
      "status": "planned",
      "version": null,
      "format": null,
      "fileName": null,
      "downloadUrl": null,
      "backupLocations": [],
      "sizeBytes": null,
      "sha256": null,
      "containsModelWeights": false,
      "profileContents": [
        "analysis_instructions",
        "twitch_terminology",
        "common_slang_examples",
        "sarcasm_examples",
        "playful_insult_examples",
        "technical_complaint_examples",
        "output_labels",
        "confidence_thresholds"
      ],
      "description": "Planned small text or JSON configuration package for French chat analysis.",
      "evaluationStatus": "not_started",
      "evaluationNotes": null,
      "optional": false
    },
    {
      "id": "prompt-ja-JP",
      "type": "language-prompt",
      "language": "ja-JP",
      "displayName": "Stream Pulse Japanese Language Profile",
      "status": "planned",
      "version": null,
      "format": null,
      "fileName": null,
      "downloadUrl": null,
      "backupLocations": [],
      "sizeBytes": null,
      "sha256": null,
      "containsModelWeights": false,
      "profileContents": [
        "analysis_instructions",
        "twitch_terminology",
        "common_slang_examples",
        "sarcasm_examples",
        "playful_insult_examples",
        "technical_complaint_examples",
        "output_labels",
        "confidence_thresholds"
      ],
      "description": "Planned small text or JSON configuration package for Japanese chat analysis.",
      "evaluationStatus": "not_started",
      "evaluationNotes": null,
      "optional": false
    },
    {
      "id": "prompt-it-IT",
      "type": "language-prompt",
      "language": "it-IT",
      "displayName": "Stream Pulse Italian Language Profile",
      "status": "planned",
      "version": null,
      "format": null,
      "fileName": null,
      "downloadUrl": null,
      "backupLocations": [],
      "sizeBytes": null,
      "sha256": null,
      "containsModelWeights": false,
      "profileContents": [
        "analysis_instructions",
        "twitch_terminology",
        "common_slang_examples",
        "sarcasm_examples",
        "playful_insult_examples",
        "technical_complaint_examples",
        "output_labels",
        "confidence_thresholds"
      ],
      "description": "Planned small text or JSON configuration package for Italian chat analysis.",